{
  "id": "hi",
  "name": "हिन्दी",
  "voice": "hf_alpha",
  "ui": {
    "hideText": "पाठ छिपाएँ",
    "showText": "पाठ दिखाएँ",
    "appTitle": "छोटी रोशनी का पुस्तकालय",
    "welcome": "छोटी रोशनी के पुस्तकालय में आपका स्वागत है",
    "chooseLanguage": "भाषा चुनें",
    "enter": "पुस्तकालय में प्रवेश करें",
    "library": "पुस्तकालय",
    "chooseBook": "एक कहानी चुनें",
    "settings": "सेटिंग्स",
    "language": "भाषा",
    "speed": "पढ़ने की गति",
    "audio": "कहानी की आवाज़",
    "volume": "आवाज़ का स्तर",
    "close": "बंद करें",
    "previous": "पिछला",
    "next": "अगला",
    "play": "चलाएँ",
    "pause": "रोकें",
    "replay": "फिर सुनें",
    "back": "लाइब्रेरी में वापस जाएँ",
    "loading": "कहानी तैयार हो रही है…",
    "retry": "फिर कोशिश करें",
    "error": "कुछ गड़बड़ हो गई।",
    "audioError": "कहानी की आवाज़ उपलब्ध नहीं है, लेकिन आप कहानी पढ़ सकते हैं।",
    "imageError": "यह चित्र लोड नहीं हो सका। फिर कोशिश करें।",
    "page": "पृष्ठ",
    "of": "में से",
    "help": "मदद",
    "helpText": "साथ में पढ़ें, सुनें और पन्ने पलटें। किसी भी पृष्ठ को रोक या फिर से चला सकते हैं।",
    "characters": "पात्र",
    "finished": "पृष्ठ पूरा हुआ",
    "source": "बाइबल का अंश",
    "loadingPause": "लोड होने की एनीमेशन रोकें",
    "loadingResume": "लोड होने की एनीमेशन फिर चलाएँ",
    "lookAround": "आस-पास देखें",
    "lookLeft": "बाईं ओर देखें",
    "centerView": "दृश्य केंद्रित करें",
    "lookRight": "दाईं ओर देखें",
    "serpent": "साँप",
    "dove": "कबूतर"
  },
  "characters": { "adam": "आदम", "eve": "हव्वा", "noah": "नूह" },
  "stories": [
    {
      "id": "eden",
      "title": "आदम, हव्वा और बाग़",
      "subtitle": "उत्पत्ति 2–3 की कहानी",
      "pages": [
        { "id": "eden-01", "title": "अदन नाम का बाग़", "segments": [
          { "id": "s1", "text": "परमेश्वर ने आकाश और पृथ्वी बनाए, फिर अदन नाम का सुंदर बाग लगाया। उन्होंने आदम को वहाँ रखा, ताकि वह उसकी देखभाल करे और उसके पेड़ों का आनंद ले।" },
          { "id": "s2", "text": "परमेश्वर ने आदम में जीवन की साँस फूँकी। हर जीव का अपना स्थान था, पर आदम को एक साथी की ज़रूरत थी।" }
        ], "image": "assets/art/eden-01.webp", "passage": "उत्पत्ति 2:4–20" },
        { "id": "eden-02", "title": "एक साथी और एक आज्ञा", "segments": [
          { "id": "s1", "text": "परमेश्वर ने आदम की पसली से हव्वा को बनाया और उसे उसके पास लाए। वे एक-दूसरे के लिए थे, बिना लज्जा और शांति में।" },
          { "id": "s2", "text": "परमेश्वर ने उन्हें बाग के फलों की अनुमति दी, पर एक पेड़ मना था: भले और बुरे के ज्ञान का पेड़। उन्होंने चेतावनी दी कि उसका फल न खाना।" }
        ], "image": "assets/art/eden-02.webp", "passage": "उत्पत्ति 2:16–25" },
        { "id": "eden-03", "title": "साँप का सवाल", "segments": [
          { "id": "s1", "text": "एक साँप ने हव्वा से बात की और परमेश्वर की आज्ञा पर सवाल उठाया। उसने कहा कि मना किया हुआ फल उन्हें परमेश्वर के समान बना देगा, और वे भले-बुरे को जानेंगे।" },
          { "id": "s2", "text": "हव्वा ने देखा कि फल अच्छा लगता है, उसे लिया और खा लिया। उसने आदम को भी दिया, और उसने भी खाया।" }
        ], "image": "assets/art/eden-03.webp", "passage": "उत्पत्ति 3:1–6" },
        { "id": "eden-04", "title": "लज्जा और छिपना", "segments": [
          { "id": "s1", "text": "तुरंत उन्हें पता चला कि वे नग्न हैं, और लज्जा ने उन्हें छिपा दिया। उन्होंने पत्तियाँ सीकर अपने शरीर ढक लिए।" },
          { "id": "s2", "text": "जब परमेश्वर ने पुकारा, आदम ने हव्वा को दोष दिया और हव्वा ने साँप को। उनका भरोसा टूट गया, और उनके चुनाव से पाप बाग में आ गया।" }
        ], "image": "assets/art/eden-04.webp", "passage": "उत्पत्ति 3:7–13" },
        { "id": "eden-05", "title": "परिणाम", "segments": [
          { "id": "s1", "text": "परमेश्वर ने कहा कि साँप शापित होगा। स्त्री का वंश उसके सिर को कुचलेगा, फिर भी साँप उसकी एड़ी को डसेगा।" },
          { "id": "s2", "text": "परमेश्वर ने हव्वा से कहा कि बच्चे जन्म देने में पीड़ा होगी, और आदम से कहा कि भूमि उसके काम का विरोध करेगी। अब उनके जीवन में दुःख और परिश्रम होगा।" }
        ], "image": "assets/art/eden-05.webp", "passage": "उत्पत्ति 3:14–19" },
        { "id": "eden-06", "title": "बाग के बाहर", "segments": [
          { "id": "s1", "text": "परमेश्वर ने आदम और हव्वा के लिए वस्त्र बनाए और उन्हें पहनाए। फिर उन्हें अदन से बाहर भेज दिया, ताकि वे जीवन के पेड़ का फल न ले सकें।" },
          { "id": "s2", "text": "करूब और एक जलती हुई तलवार जीवन के पेड़ के रास्ते की रखवाली करते थे। आदम और हव्वा वापस नहीं जा सकते थे।" }
        ], "image": "assets/art/eden-06.webp", "passage": "उत्पत्ति 3:20–24" },
        { "id": "eden-07", "title": "अदन के बाहर का जीवन", "segments": [
          { "id": "s1", "text": "अदन के बाहर आदम और हव्वा ने काँटों के बीच भोजन के लिए कठिन परिश्रम किया। वे बूढ़े होते और उस मिट्टी में लौटते जिससे आदम बनाया गया था।" },
          { "id": "s2", "text": "हानि सच्ची थी, पर परमेश्वर ने उन्हें देखना नहीं छोड़ा। उनकी कहानी दिखाती है कि अवज्ञा कैसे चोट पहुँचाती है और मनुष्यों को परमेश्वर के बचाव की ज़रूरत क्यों है।" }
        ], "image": "assets/art/eden-07.webp", "passage": "उत्पत्ति 3:17–24" },
        { "id": "eden-08", "title": "आगे चलती हुई प्रतिज्ञा", "segments": [
          { "id": "s1", "text": "अदन उनके पीछे रह गया, फिर भी साँप के बारे में परमेश्वर के वचन में विजय की प्रतिज्ञा थी। कहानी आगे बढ़ती है और बाइबल उस आशा को सँभालती है।" },
          { "id": "s2", "text": "आदम और हव्वा अपने बल से टूटी हुई बात को ठीक नहीं कर सकते थे। उनका पहला चुनाव हमें परमेश्वर के अच्छे मार्गों पर भरोसा करना और उसकी दया माँगना सिखाता है।" }
        ], "image": "assets/art/eden-08.webp", "passage": "उत्पत्ति 3:14–24" }
      ]
    },
    {
      "id": "noah",
      "title": "नूह और महाबाढ़",
      "subtitle": "उत्पत्ति 6–9 की कहानी",
      "pages": [
        { "id": "noah-01", "title": "बिगड़ी हुई दुनिया", "segments": [
          { "id": "s1", "text": "परमेश्वर ने देखा कि हिंसा और बुराई पूरी पृथ्वी पर फैल गई थी। उनकी अच्छी बनाई दुनिया भयानक नुकसान से भर गई थी।" },
          { "id": "s2", "text": "नूह परमेश्वर के साथ चलता था। परमेश्वर ने उसे बताया कि बड़ी बाढ़ आने वाली है, और उसके परिवार और जानवरों की रक्षा का मार्ग दिया।" }
        ], "image": "assets/art/noah-01.webp", "passage": "उत्पत्ति 6:5–22" },
        { "id": "noah-02", "title": "एक बड़ा जहाज़ बनाना", "segments": [
          { "id": "s1", "text": "परमेश्वर ने नूह से कहा कि वह भीतर कमरों वाला एक बहुत बड़ा जहाज़ बनाए, जो बढ़ते पानी पर टिक सके। नूह ने परमेश्वर की आज्ञा मानी।" },
          { "id": "s2", "text": "उसने जहाज़ को इस तरह ढका कि पानी भीतर न जा सके। वह कोई छोटी खिलौना-नाव नहीं, बल्कि परिवार और अनेक जीवों के लिए आश्रय था।" }
        ], "image": "assets/art/noah-02.webp", "passage": "उत्पत्ति 6:14–22" },
        { "id": "noah-03", "title": "जहाज़ के भीतर", "segments": [
          { "id": "s1", "text": "हर प्रकार के जानवर जोड़ों में नूह के पास आए, और नूह ने उन्हें भीतर लाया। उसकी पत्नी, उसके बेटे और उनकी पत्नियाँ भी भीतर गईं।" },
          { "id": "s2", "text": "तब परमेश्वर ने द्वार बंद कर दिया। बारिश शुरू हुई, और जहाज़ प्रतीक्षा करता रहा जबकि बाहर की दुनिया बदल गई।" }
        ], "image": "assets/art/noah-03.webp", "passage": "उत्पत्ति 7:1–16" },
        { "id": "noah-04", "title": "धरती पर चढ़ता पानी", "segments": [
          { "id": "s1", "text": "चालीस दिन और रात बारिश होती रही, और पानी ऊँचा उठता गया। जहाज़ भूमि से ऊपर उठा और तैरने लगा।" },
          { "id": "s2", "text": "बाढ़ ने धरती और सबसे ऊँचे पहाड़ों तक को ढक लिया। विशाल जहाज़ के भीतर नूह का परिवार और जानवर अँधेरे में प्रतीक्षा करते रहे।" }
        ], "image": "assets/art/noah-04.webp", "passage": "उत्पत्ति 7:17–24" },
        { "id": "noah-05", "title": "आशा का पत्ता", "segments": [
          { "id": "s1", "text": "अंत में परमेश्वर ने हवा चलाई और पानी घटने लगा। जहाज़ अरारात के पहाड़ों पर आकर टिक गया।" },
          { "id": "s2", "text": "नूह ने पहले कौआ और फिर कबूतर भेजा। जब कबूतर ताज़ा जैतून का पत्ता लेकर लौटा, नूह जान गया कि धरती फिर दिखाई दे रही है।" }
        ], "image": "assets/art/noah-05.webp", "passage": "उत्पत्ति 8:1–12" },
        { "id": "noah-06", "title": "बदली हुई दुनिया में बाहर", "segments": [
          { "id": "s1", "text": "जब भूमि सूख गई, परमेश्वर ने नूह से जहाज़ से बाहर आने को कहा। उसका परिवार निकला, और हर जानवर को फिर खुली धरती मिली।" },
          { "id": "s2", "text": "जो लोग जहाज़ के बाहर रह गए, वे पानी में बह गए और डूबकर मर गए। बाढ़ न्याय थी, और बचा हुआ परिवार एक गंभीर, बदली हुई दुनिया में निकला।" }
        ], "image": "assets/art/noah-06.webp", "passage": "उत्पत्ति 7:21–23; 8:13–19" },
        { "id": "noah-07", "title": "परमेश्वर की वाचा", "segments": [
          { "id": "s1", "text": "नूह ने एक वेदी बनाई और परमेश्वर की आराधना की। परमेश्वर ने नूह, उसके परिवार और हर जीवित प्राणी के साथ वाचा बाँधी।" },
          { "id": "s2", "text": "परमेश्वर ने प्रतिज्ञा की कि बाढ़ फिर कभी धरती के सारे जीवन को नष्ट नहीं करेगी। उसने बादलों में इंद्रधनुष को अपनी प्रतिज्ञा का चिन्ह बनाया।" }
        ], "image": "assets/art/noah-07.webp", "passage": "उत्पत्ति 8:20–22; 9:1–17" },
        { "id": "noah-08", "title": "इंद्रधनुष को याद रखना", "segments": [
          { "id": "s1", "text": "इंद्रधनुष परमेश्वर की वाचा की उजली याद बन गया। जब उसके रंग दिखाई देते, परमेश्वर अपनी प्रतिज्ञा को याद करता और उसके लोग भी उसे याद कर सकते थे।" },
          { "id": "s2", "text": "बाढ़ की कहानी दुःख, बचाव और नई शुरुआत को साथ रखती है। पानी चले जाने के बाद नूह का परिवार परमेश्वर की दया को दुनिया में लेकर चला।" }
        ], "image": "assets/art/noah-08.webp", "passage": "उत्पत्ति 9:8–17" }
      ]
    }
  ]
}
