{
  "id": "en-GB",
  "name": "English (UK)",
  "voice": "bf_emma",
  "ui": {
    "hideText": "Hide text",
    "showText": "Show text",
    "appTitle": "Little Light Library",
    "welcome": "Welcome to the Little Light Library",
    "chooseLanguage": "Choose a language",
    "enter": "Enter the library",
    "library": "Library",
    "chooseBook": "Choose a story",
    "settings": "Settings",
    "language": "Language",
    "speed": "Reading speed",
    "audio": "Narration",
    "volume": "Volume",
    "close": "Close",
    "previous": "Previous",
    "next": "Next",
    "play": "Play",
    "pause": "Pause",
    "replay": "Replay",
    "back": "Back to library",
    "loading": "Preparing the story…",
    "retry": "Try again",
    "error": "Something went wrong.",
    "audioError": "Narration is unavailable, but you can still read the story.",
    "imageError": "This picture could not load. Try again.",
    "page": "Page",
    "of": "of",
    "help": "Help",
    "helpText": "Read, listen, and turn pages together. You can pause or replay any page.",
    "characters": "Characters",
    "finished": "Page complete",
    "source": "Bible passage",
    "loadingPause": "Pause loading animation",
    "loadingResume": "Resume loading animation",
    "lookAround": "Look around",
    "lookLeft": "Look left",
    "centerView": "Centre view",
    "lookRight": "Look right",
    "serpent": "Serpent",
    "dove": "Dove"
  },
  "characters": { "adam": "Adam", "eve": "Eve", "noah": "Noah" },
  "stories": [
    { "id": "eden", "title": "Adam, Eve, and the Garden", "subtitle": "A story from Genesis 2–3", "pages": [
      { "id": "eden-01", "title": "A garden called Eden", "segments": [{ "id": "s1", "text": "God made the heavens and the earth, then planted a beautiful garden called Eden. He placed Adam there to tend it and enjoy its trees." }, { "id": "s2", "text": "God breathed life into Adam. Every creature had a place, but Adam needed a companion." }], "image": "assets/art/eden-01.webp", "passage": "Genesis 2:4–20" },
      { "id": "eden-02", "title": "A companion and a command", "segments": [{ "id": "s1", "text": "God made Eve from Adam's side and brought her to him. They belonged together, unashamed and at peace." }, { "id": "s2", "text": "God gave them the garden's fruit, but one tree was forbidden: the tree of the knowledge of good and evil. He warned them not to eat it." }], "image": "assets/art/eden-02.webp", "passage": "Genesis 2:16–25" },
      { "id": "eden-03", "title": "The serpent's question", "segments": [{ "id": "s1", "text": "A serpent spoke to Eve and questioned God's command. It promised that the forbidden fruit would make them like God, knowing good and evil." }, { "id": "s2", "text": "Eve saw that the fruit looked good, took it, and ate. She gave some to Adam, and he ate too." }], "image": "assets/art/eden-03.webp", "passage": "Genesis 3:1–6" },
      { "id": "eden-04", "title": "Shame and hiding", "segments": [{ "id": "s1", "text": "At once they knew they were naked, and shame made them hide. They stitched leaves together to cover themselves." }, { "id": "s2", "text": "When God called, Adam blamed Eve, and Eve blamed the serpent. Their trust had broken, and their choice had brought sin into the garden." }], "image": "assets/art/eden-04.webp", "passage": "Genesis 3:7–13" },
      { "id": "eden-05", "title": "Consequences", "segments": [{ "id": "s1", "text": "God told the serpent that it would be cursed. The woman's offspring would strike its head, though the serpent would strike his heel." }, { "id": "s2", "text": "God told Eve that bringing children would bring pain, and told Adam that the ground would resist his work. Their lives would now carry sorrow and toil." }], "image": "assets/art/eden-05.webp", "passage": "Genesis 3:14–19" },
      { "id": "eden-06", "title": "Outside the garden", "segments": [{ "id": "s1", "text": "God made garments for Adam and Eve and clothed them. Then he sent them out of Eden, so they could not take fruit from the tree of life." }, { "id": "s2", "text": "Cherubim and a flaming sword guarded the way to the tree of life. Adam and Eve could not go back." }], "image": "assets/art/eden-06.webp", "passage": "Genesis 3:20–24" },
      { "id": "eden-07", "title": "Life beyond Eden", "segments": [{ "id": "s1", "text": "Outside Eden, Adam and Eve worked hard for food among thorns. They would grow old and return to the dust from which Adam had been made." }, { "id": "s2", "text": "The loss was real, but God had not stopped seeing them. Their story showed how disobedience wounds, and why people need God's rescue." }], "image": "assets/art/eden-07.webp", "passage": "Genesis 3:17–24" },
      { "id": "eden-08", "title": "A promise carried forward", "segments": [{ "id": "s1", "text": "Eden was behind them, yet God's word about the serpent carried a promise of victory. The Bible keeps that hope as its story continues." }, { "id": "s2", "text": "Adam and Eve could not repair what they had broken by themselves. Their first choice reminds us to trust God's good ways and seek his mercy." }], "image": "assets/art/eden-08.webp", "passage": "Genesis 3:14–24" }
    ] },
    { "id": "noah", "title": "Noah and the Great Flood", "subtitle": "A story from Genesis 6–9", "pages": [
      { "id": "noah-01", "title": "A world gone wrong", "segments": [{ "id": "s1", "text": "God saw that violence and wickedness had spread across the earth. The world he made good was filled with terrible harm." }, { "id": "s2", "text": "Noah walked with God. God told him that a great flood was coming, and gave him a way to protect his family and the animals." }], "image": "assets/art/noah-01.webp", "passage": "Genesis 6:5–22" },
      { "id": "noah-02", "title": "Build a great ark", "segments": [{ "id": "s1", "text": "God told Noah to build an enormous ark with rooms inside, strong enough to ride the rising water. Noah followed God's instructions." }, { "id": "s2", "text": "He covered the ark so water could not enter. It was no little boat; it was a place of shelter for a family and many creatures." }], "image": "assets/art/noah-02.webp", "passage": "Genesis 6:14–22" },
      { "id": "noah-03", "title": "Into the ark", "segments": [{ "id": "s1", "text": "Animals came to Noah, pairs of every kind, and Noah brought them inside. His wife, his sons, and their wives entered too." }, { "id": "s2", "text": "Then God shut the door. Rain began to fall, and the ark waited while the world outside changed." }], "image": "assets/art/noah-03.webp", "passage": "Genesis 7:1–16" },
      { "id": "noah-04", "title": "Waters over the earth", "segments": [{ "id": "s1", "text": "Rain fell for forty days and nights, and the waters rose higher and higher. The ark lifted from the ground and began to float." }, { "id": "s2", "text": "The flood covered the land and even the highest mountains. Inside the great ark, Noah's family and the animals waited in the darkness." }], "image": "assets/art/noah-04.webp", "passage": "Genesis 7:17–24" },
      { "id": "noah-05", "title": "A leaf of hope", "segments": [{ "id": "s1", "text": "At last God sent a wind, and the waters began to fall. The ark came to rest on the mountains of Ararat." }, { "id": "s2", "text": "Noah sent out a raven and then a dove. When the dove returned with a fresh olive leaf, Noah knew the earth was appearing again." }], "image": "assets/art/noah-05.webp", "passage": "Genesis 8:1–12" },
      { "id": "noah-06", "title": "Out into a changed world", "segments": [{ "id": "s1", "text": "When the ground was dry, God told Noah to leave the ark. His family came out, and every animal found the open earth again." }, { "id": "s2", "text": "People who remained outside the ark were swept away and drowned. The flood was judgement, and the rescued family stepped into a solemn, changed world." }], "image": "assets/art/noah-06.webp", "passage": "Genesis 7:21–23; 8:13–19" },
      { "id": "noah-07", "title": "God's covenant", "segments": [{ "id": "s1", "text": "Noah built an altar and worshipped God. God made a covenant with Noah, his family, and every living creature." }, { "id": "s2", "text": "God promised that a flood would never again destroy all life on earth. He set a rainbow in the clouds as the sign of his promise." }], "image": "assets/art/noah-07.webp", "passage": "Genesis 8:20–22; 9:1–17" },
      { "id": "noah-08", "title": "Remember the rainbow", "segments": [{ "id": "s1", "text": "The rainbow became a bright reminder of God's covenant. Whenever its colours appeared, God remembered his promise, and his people could remember it too." }, { "id": "s2", "text": "The flood story holds sorrow, rescue, and a new beginning together. Noah's family carried God's mercy into the world after the waters were gone." }], "image": "assets/art/noah-08.webp", "passage": "Genesis 9:8–17" }
    ] }
  ]
}
