{
  "id": "ja",
  "name": "日本語",
  "voice": "jf_alpha",
  "ui": {
    "hideText": "テキストを隠す",
    "showText": "テキストを表示",
    "appTitle": "小さな光の図書館",
    "welcome": "小さな光の図書館へようこそ",
    "chooseLanguage": "言語を選ぶ",
    "enter": "図書館に入る",
    "library": "図書館",
    "chooseBook": "お話を選ぶ",
    "settings": "設定",
    "language": "言語",
    "speed": "読む速さ",
    "audio": "ナレーション",
    "volume": "音量",
    "close": "閉じる",
    "previous": "前へ",
    "next": "次へ",
    "play": "再生",
    "pause": "一時停止",
    "replay": "もう一度",
    "back": "ライブラリーに戻る",
    "loading": "お話を準備しています…",
    "retry": "もう一度試す",
    "error": "問題が起きました。",
    "audioError": "ナレーションは利用できませんが、お話は読めます。",
    "imageError": "絵を読み込めませんでした。もう一度試してください。",
    "page": "ページ",
    "of": "の",
    "help": "ヘルプ",
    "helpText": "一緒に読んで、聞いて、ページをめくりましょう。どのページも一時停止やもう一度の再生ができます。",
    "characters": "登場人物",
    "finished": "ページ完了",
    "source": "聖書の箇所",
    "loadingPause": "読み込みアニメーションを一時停止",
    "loadingResume": "読み込みアニメーションを再開",
    "lookAround": "見回す",
    "lookLeft": "左を見る",
    "centerView": "中央に戻す",
    "lookRight": "右を見る",
    "serpent": "蛇",
    "dove": "鳩"
  },
  "characters": { "adam": "アダム", "eve": "エバ", "noah": "ノア" },
  "stories": [
    {
      "id": "eden",
      "title": "アダムとエバ、そして園",
      "subtitle": "創世記2–3章のお話",
      "pages": [
        { "id": "eden-01", "title": "エデンと呼ばれた園", "segments": [
          { "id": "s1", "text": "神は天と地を造り、美しいエデンの園を植えました。神はアダムをそこに置き、園を耕し、木々の実を楽しませました。" },
          { "id": "s2", "text": "神はアダムに命の息を吹き込みました。すべての生き物には居場所がありましたが、アダムには仲間が必要でした。" }
        ], "image": "assets/art/eden-01.webp", "passage": "創世記2:4–20" },
        { "id": "eden-02", "title": "仲間と一つの命令", "segments": [
          { "id": "s1", "text": "神はアダムのわき腹からエバを造り、彼のもとへ連れてきました。二人は恥じることなく、平和に一緒にいました。" },
          { "id": "s2", "text": "神は園の実を二人に与えましたが、一つの木だけは禁止しました。善悪の知識の木の実を食べてはいけない、と警告したのです。" }
        ], "image": "assets/art/eden-02.webp", "passage": "創世記2:16–25" },
        { "id": "eden-03", "title": "蛇の問いかけ", "segments": [
          { "id": "s1", "text": "蛇はエバに話しかけ、神の命令を疑わせました。禁じられた実を食べれば、善悪を知る神のようになれる、と言ったのです。" },
          { "id": "s2", "text": "エバは実がおいしそうに見えたので、取って食べました。そしてアダムにも渡し、アダムも食べました。" }
        ], "image": "assets/art/eden-03.webp", "passage": "創世記3:1–6" },
        { "id": "eden-04", "title": "恥と隠れ場所", "segments": [
          { "id": "s1", "text": "二人はすぐに、自分たちが裸だと知り、恥ずかしくて隠れました。葉をつなぎ合わせて、体を覆いました。" },
          { "id": "s2", "text": "神が呼ぶと、アダムはエバを責め、エバは蛇を責めました。二人の信頼は壊れ、選んだ罪が園に入ったのです。" }
        ], "image": "assets/art/eden-04.webp", "passage": "創世記3:7–13" },
        { "id": "eden-05", "title": "選びの結果", "segments": [
          { "id": "s1", "text": "神は蛇がのろわれると告げました。女の子孫は蛇の頭を打ち砕きますが、蛇はそのかかとを打つ、と言われました。" },
          { "id": "s2", "text": "神はエバに、子どもを産む痛みを告げ、アダムには大地が仕事に抵抗すると告げました。二人の生活には悲しみと苦労が伴うようになりました。" }
        ], "image": "assets/art/eden-05.webp", "passage": "創世記3:14–19" },
        { "id": "eden-06", "title": "園の外へ", "segments": [
          { "id": "s1", "text": "神はアダムとエバのために衣を作り、二人に着せました。それから、命の木の実を取れないように、二人をエデンから追い出しました。" },
          { "id": "s2", "text": "ケルビムと燃える剣が、命の木への道を守っていました。アダムとエバは戻ることができませんでした。" }
        ], "image": "assets/art/eden-06.webp", "passage": "創世記3:20–24" },
        { "id": "eden-07", "title": "園の外の暮らし", "segments": [
          { "id": "s1", "text": "エデンの外で、アダムとエバは茨の中で食べ物を得るために働きました。二人は年を取り、アダムが造られた土へ戻ることになりました。" },
          { "id": "s2", "text": "失ったものは本当でした。それでも神は二人を見捨てませんでした。この物語は、罪が人を傷つけ、神の救いが必要だと示します。" }
        ], "image": "assets/art/eden-07.webp", "passage": "創世記3:17–24" },
        { "id": "eden-08", "title": "受け継がれる約束", "segments": [
          { "id": "s1", "text": "エデンは二人の後ろになりました。それでも蛇についての神の言葉には勝利の約束があり、聖書は物語の中でその希望を伝え続けます。" },
          { "id": "s2", "text": "アダムとエバは、自分たちだけで壊したものを直せませんでした。最初の選びは、神の良い道を信じ、あわれみを求めることを教えます。" }
        ], "image": "assets/art/eden-08.webp", "passage": "創世記3:14–24" }
      ]
    },
    {
      "id": "noah",
      "title": "ノアと大洪水",
      "subtitle": "創世記6–9章のお話",
      "pages": [
        { "id": "noah-01", "title": "悪に満ちた世界", "segments": [
          { "id": "s1", "text": "神は、地上に暴力と悪が広がっているのを見ました。良いものとして造られた世界は、ひどい害で満ちていました。" },
          { "id": "s2", "text": "ノアは神と共に歩んでいました。神は大洪水が来ると告げ、家族と動物を守る道をノアに示しました。" }
        ], "image": "assets/art/noah-01.webp", "passage": "創世記6:5–22" },
        { "id": "noah-02", "title": "大きな箱舟を造る", "segments": [
          { "id": "s1", "text": "神はノアに、部屋を持ち、増える水に耐えられる、とても大きな箱舟を造るよう命じました。ノアは神の言葉に従いました。" },
          { "id": "s2", "text": "水が入らないように箱舟を覆いました。それは小さなおもちゃの船ではなく、家族と多くの生き物の避難所でした。" }
        ], "image": "assets/art/noah-02.webp", "passage": "創世記6:14–22" },
        { "id": "noah-03", "title": "箱舟の中へ", "segments": [
          { "id": "s1", "text": "あらゆる種類の動物がつがいでノアのもとに来て、ノアは箱舟の中へ入れました。ノアの妻と息子たち、その妻たちも入りました。" },
          { "id": "s2", "text": "それから神が戸を閉めました。雨が降り始め、外の世界が変わる中で、箱舟は浮かびました。" }
        ], "image": "assets/art/noah-03.webp", "passage": "創世記7:1–16" },
        { "id": "noah-04", "title": "地をおおう水", "segments": [
          { "id": "s1", "text": "四十日四十夜、雨が降り続き、水はどんどん高くなりました。箱舟は地面から離れ、浮かび始めました。" },
          { "id": "s2", "text": "洪水は大地も、最も高い山々もおおいました。大きな箱舟の中で、ノアの家族と動物たちは暗闇の中で待ちました。" }
        ], "image": "assets/art/noah-04.webp", "passage": "創世記7:17–24" },
        { "id": "noah-05", "title": "希望の葉", "segments": [
          { "id": "s1", "text": "ついに神が風を吹かせ、水は少しずつ引き始めました。箱舟はアララトの山々に止まりました。" },
          { "id": "s2", "text": "ノアはカラスを、次に鳩を放ちました。鳩が新しいオリーブの葉をくわえて戻ると、地面が現れ始めたと分かりました。" }
        ], "image": "assets/art/noah-05.webp", "passage": "創世記8:1–12" },
        { "id": "noah-06", "title": "変わった世界へ", "segments": [
          { "id": "s1", "text": "地面が乾くと、神はノアに箱舟から出るよう告げました。家族は外へ出て、動物たちも再び大地に戻りました。" },
          { "id": "s2", "text": "箱舟の外に残った人々は、水にさらわれておぼれ死にました。洪水はさばきでした。救われた家族は、厳粛で変わってしまった世界へ足を踏み出しました。" }
        ], "image": "assets/art/noah-06.webp", "passage": "創世記7:21–23; 8:13–19" },
        { "id": "noah-07", "title": "神の契約", "segments": [
          { "id": "s1", "text": "ノアは祭壇を築き、神を礼拝しました。神はノアと家族、そしてすべての生き物と契約を結びました。" },
          { "id": "s2", "text": "神は、洪水が再びすべての命を地上から滅ぼすことはないと約束しました。雲の中に虹を置き、約束のしるしとしました。" }
        ], "image": "assets/art/noah-07.webp", "passage": "創世記8:20–22; 9:1–17" },
        { "id": "noah-08", "title": "虹を覚えておく", "segments": [
          { "id": "s1", "text": "虹は神の契約を思い出させる明るいしるしになりました。その色が現れるたびに神は約束を覚え、人々もそれを覚えることができました。" },
          { "id": "s2", "text": "洪水の物語には、悲しみと救いと新しい始まりがあります。水が去った後、ノアの家族は神のあわれみを世界へ運びました。" }
        ], "image": "assets/art/noah-08.webp", "passage": "創世記9:8–17" }
      ]
    }
  ]
}
